userId,mse,rec_1,rec_2,rec_3,rec_4,rec_5
40,1.4289095401763916,Forrest Gump (1994),"Usual Suspects, The (1995)",Schindler's List (1993),"Silence of the Lambs, The (1991)",Seven (a.k.a. Se7en) (1995)
92,15.95300579071045,Bad Boys II (2003),"Collector, The (2009)",Miss Representation (2011),Ride Along 2 (2016),Something Wicked This Way Comes (1983)
123,1.967238187789917,Forrest Gump (1994),Intouchables (2011),Coco (2017),"Dark Knight, The (2008)",Kids (1995)
245,7.194057464599609,"Shawshank Redemption, The (1994)",Aladdin (1992),"Princess Bride, The (1987)",Inside Job (2010),The Theory of Everything (2014)
312,1.5509588718414307,Titanic (1953),Coco (2017),Intouchables (2011),Wallace & Gromit: The Best of Aardman Animation (1996),"Fog of War: Eleven Lessons from the Life of Robert S. McNamara, The (2003)"
460,2.418187379837036,Intouchables (2011),Kids (1995),Coco (2017),Incendies (2010),"Discreet Charm of the Bourgeoisie, The (Charme discret de la bourgeoisie, Le) (1972)"
514,0.7077156901359558,Coco (2017),Intouchables (2011),Titanic (1953),"Shawshank Redemption, The (1994)",Swept Away (Travolti da un insolito destino nell'azzurro mare d'Agosto) (1975)
590,1.2549293041229248,Coco (2017),Swept Away (Travolti da un insolito destino nell'azzurro mare d'Agosto) (1975),"Fog of War: Eleven Lessons from the Life of Robert S. McNamara, The (2003)",Titanic (1953),Once Were Warriors (1994)
